{
  "schema_version": "1.0.0",
  "version": "1.20.0",
  "compiled_at": "2026-10-20T10:18:44.541033+00:00",
  "timezone": "Asia/Shanghai",
  "labels": {
    "category": {
      "speaker": "音箱与语音",
      "mobile": "手机与平板",
      "computer": "电脑与瘦客户机",
      "network": "路由与 NAS",
      "tv": "电视与盒子",
      "ereader": "电子书与墨水屏",
      "robot": "机器人",
      "smarthome": "智能家居",
      "camera": "摄像头",
      "audio": "播放器与音响",
      "wearable": "手表与可穿戴",
      "gaming": "游戏设备",
      "peripheral": "打印机与外设"
    },
    "ai": {
      "native": "AI 功能改造",
      "assisted": "AI 辅助开发/配置",
      "adjacent": "AI 周边用途",
      "infrastructure": "传统复活基础设施"
    },
    "difficulty": {
      "easy": "入门",
      "medium": "进阶",
      "high": "高难度"
    },
    "evidence": {
      "E0": "候选 / 证据不足",
      "E1": "源码与部署文档",
      "E2": "作者实机陈述 / 演示",
      "E3": "独立复现已核验"
    },
    "maintenance": {
      "not-archived": "仓库未归档",
      "archived": "已归档",
      "deprecated": "作者宣布停维护",
      "moved": "已迁移 / 旧镜像归档",
      "historical-patched": "历史方法 / 漏洞已修复",
      "stale": "超过一年无 push（不等于弃用）"
    }
  },
  "projects": [
    {
      "id": "xiaogpt",
      "name": "XiaoGPT",
      "category": "speaker",
      "ai_relation": "native",
      "entry_type": "case",
      "family": "xiaogpt",
      "summary_zh": "让已有小爱音箱转接大模型，保留原设备语音入口。",
      "device_scope": "小爱音箱；README 示例 LX06，其他型号须核对 hardware 参数",
      "model_examples": [
        "LX06"
      ],
      "firmware_requirement": null,
      "region_requirement": null,
      "compatibility_status": "follow-upstream-matrix",
      "use_cases": [
        "语音助手"
      ],
      "method": "服务桥接",
      "difficulty": "medium",
      "difficulty_basis": "编辑按安装、固件、拆装与排障步骤评估，不是作者给出的难度评分。",
      "limitations": [
        "依赖小米账号和语音接口；并非完全离线固件。"
      ],
      "repo_url": "https://github.com/yihong0618/xiaogpt",
      "github_snapshot_url": "https://github.com/yihong0618/xiaogpt",
      "website_url": null,
      "tutorial_url": "https://github.com/yihong0618/xiaogpt/blob/main/README.md",
      "compatibility_url": "https://github.com/yihong0618/xiaogpt/blob/main/README.md",
      "x_sources": [],
      "evidence": {
        "level": "E1",
        "reason": "README 给出 LX06 启动、配置文件和多模型后端方法，并附作者演示媒体链接；本次未播放媒体。",
        "hardware_tested_by_catalog": false,
        "independent_reproduction_verified": false
      },
      "sources": [
        {
          "url": "https://github.com/yihong0618/xiaogpt/blob/main/README.md",
          "kind": "upstream-document",
          "status": "content-reviewed",
          "checked_at": "2026-10-20T10:06:02.366095+00:00",
          "readme_blob_sha": "c599328bd3677f9685140453dc7330a38f4d304b",
          "content_sha256": "6769f24637381c0a56ac0be30b52f6d9f7bd70a005ea63c314cf4851ca08250a"
        }
      ],
      "maintenance": {
        "status": "not-archived",
        "github_archived": false,
        "last_push_at": "2026-10-07T05:49:36Z",
        "checked_at": "2026-10-20T10:06:02.366095+00:00",
        "note": "未归档/近期 push 不能证明当前型号无故障，镜像迁移也不等于项目停止维护。"
      },
      "license": {
        "label": "MIT",
        "url": "https://github.com/yihong0618/xiaogpt/blob/main/LICENSE",
        "checked_at": "2026-10-20T10:06:02.366095+00:00",
        "scope": "此仓库根许可证或 README 声明；不代表捆绑固件、模型、品牌或第三方组件同许可。"
      },
      "requirements": {
        "disassembly": "no",
        "soldering": "no",
        "cloud_api": "required-xiaomi; optional-model-provider"
      },
      "cost": {
        "amount": null,
        "currency": null,
        "status": "UNKNOWN",
        "items": [
          "常开主机",
          "按需付费的模型/TTS 服务"
        ],
        "note": "未核价；开源许可证不代表硬件、托管、电力和云服务总成本为零。"
      },
      "risk": {
        "data_loss": "possible",
        "bricking": "workflow-dependent",
        "recovery": "停止桥接进程可停止转发；本条路径不替换音箱固件。",
        "recovery_url": "https://github.com/yihong0618/xiaogpt#readme"
      },
      "keywords": [
        "Xiaomi XiaoAI ChatGPT",
        "小爱音箱 大模型 免刷机",
        "XiaoGPT",
        "speaker",
        "语音助手"
      ],
      "checked_at": "2026-10-20T10:06:02.366095+00:00",
      "editorial_reviewed_at": "2026-10-20T10:18:44.541033+00:00",
      "latest_release": {
        "tag": "v3.23",
        "url": "https://github.com/yihong0618/xiaogpt/releases/tag/v3.23",
        "published_at": "2025-10-26T01:31:37Z"
      }
    },
    {
      "id": "open-xiaoai",
      "name": "Open-XiaoAI",
      "category": "speaker",
      "ai_relation": "native",
      "entry_type": "case",
      "family": "open-xiaoai",
      "summary_zh": "接管旧小爱音箱的麦克风和播放链路，连接外部 AI 服务。",
      "device_scope": "小爱音箱 Pro LX06 / 小米智能音箱 Pro OH2P；按型号刷机文档",
      "model_examples": [
        "LX06",
        "OH2P"
      ],
      "firmware_requirement": null,
      "region_requirement": null,
      "compatibility_status": "follow-upstream-matrix",
      "use_cases": [
        "语音助手"
      ],
      "method": "补丁固件",
      "difficulty": "high",
      "difficulty_basis": "编辑按安装、固件、拆装与排障步骤评估，不是作者给出的难度评分。",
      "limitations": [
        "补丁固件有型号限制，不能将教程推广到所有小爱音箱。"
      ],
      "repo_url": "https://github.com/idootop/open-xiaoai",
      "github_snapshot_url": "https://github.com/idootop/open-xiaoai",
      "website_url": null,
      "tutorial_url": "https://github.com/idootop/open-xiaoai/blob/main/docs/flash.md",
      "compatibility_url": "https://github.com/idootop/open-xiaoai/blob/main/README.md",
      "x_sources": [],
      "evidence": {
        "level": "E1",
        "reason": "README 明确限定两款 Pro 音箱，提供固件、客户端、服务端三步入口；仓库已归档，仍有历史可复现材料。",
        "hardware_tested_by_catalog": false,
        "independent_reproduction_verified": false
      },
      "sources": [
        {
          "url": "https://github.com/idootop/open-xiaoai/blob/main/README.md",
          "kind": "upstream-document",
          "status": "content-reviewed",
          "checked_at": "2026-10-20T10:06:02.367094+00:00",
          "readme_blob_sha": "42264b979ad3a4ee77012ceac8a02d93c4aa2c46",
          "content_sha256": "64cfb5a0dbeb91fe1b62696a22a313c300b4ee93f17dc4cf7c03ec4d22c8b517"
        }
      ],
      "maintenance": {
        "status": "archived",
        "github_archived": true,
        "last_push_at": "2026-04-04T07:58:12Z",
        "checked_at": "2026-10-20T10:06:02.367094+00:00",
        "note": "未归档/近期 push 不能证明当前型号无故障，镜像迁移也不等于项目停止维护。"
      },
      "license": {
        "label": "MIT",
        "url": "https://github.com/idootop/open-xiaoai/blob/main/LICENSE",
        "checked_at": "2026-10-20T10:06:02.367094+00:00",
        "scope": "此仓库根许可证或 README 声明；不代表捆绑固件、模型、品牌或第三方组件同许可。"
      },
      "requirements": {
        "disassembly": "LX06: yes; OH2P: no（按官方教程）",
        "soldering": "no-in-documented-USB-route",
        "cloud_api": "optional"
      },
      "cost": {
        "amount": null,
        "currency": null,
        "status": "UNKNOWN",
        "items": [
          "主机",
          "按配置选用模型/API 服务"
        ],
        "note": "未核价；开源许可证不代表硬件、托管、电力和云服务总成本为零。"
      },
      "risk": {
        "data_loss": "possible",
        "bricking": "possible",
        "recovery": "官方 flash.md 说明使用双系统分区，可切回 boot1；该路径取决于原分区完好，本次未实机验证。",
        "recovery_url": "https://github.com/idootop/open-xiaoai/blob/main/docs/flash.md"
      },
      "keywords": [
        "Open XiaoAI LX06 OH2P",
        "小爱音箱 Pro 刷机 AI",
        "Open-XiaoAI",
        "speaker",
        "语音助手"
      ],
      "checked_at": "2026-10-20T10:06:02.367094+00:00",
      "editorial_reviewed_at": "2026-10-20T10:18:44.541033+00:00",
      "latest_release": {
        "tag": "OH2P_1.58.6",
        "url": "https://github.com/idootop/open-xiaoai/releases/tag/OH2P_1.58.6",
        "published_at": "2026-01-01T09:10:12Z"
      }
    },
    {
      "id": "mi-gpt",
      "name": "MiGPT",
      "category": "speaker",
      "ai_relation": "native",
      "entry_type": "platform",
      "family": "mi-gpt",
      "summary_zh": "以服务端桥接方式为小爱音箱增加大模型对话。",
      "device_scope": "文档兼容表中的小米小爱音箱",
      "model_examples": [],
      "firmware_requirement": null,
      "region_requirement": null,
      "compatibility_status": "follow-upstream-matrix",
      "use_cases": [
        "语音助手"
      ],
      "method": "服务桥接",
      "difficulty": "medium",
      "difficulty_basis": "编辑按安装、固件、拆装与排障步骤评估，不是作者给出的难度评分。",
      "limitations": [
        "历史方案；归档与替代项目应优先阅读。"
      ],
      "repo_url": "https://github.com/idootop/mi-gpt",
      "github_snapshot_url": "https://github.com/idootop/mi-gpt",
      "website_url": null,
      "tutorial_url": "https://github.com/idootop/mi-gpt/blob/main/README.md",
      "compatibility_url": "https://github.com/idootop/mi-gpt/blob/main/docs/compatibility.md",
      "x_sources": [],
      "evidence": {
        "level": "E1",
        "reason": "README 有安装配置、模型连接和型号兼容文档，明确宣布停止维护。",
        "hardware_tested_by_catalog": false,
        "independent_reproduction_verified": false
      },
      "sources": [
        {
          "url": "https://github.com/idootop/mi-gpt/blob/main/README.md",
          "kind": "upstream-document",
          "status": "content-reviewed",
          "checked_at": "2026-10-20T10:06:02.368094+00:00",
          "readme_blob_sha": "eb0219634283710e5d770f8b63a5c1526e9695c1",
          "content_sha256": "1a5d92a0d9d9021b7a6090ef8832c24ba89dbd194b5bf2d5d309afec0b3d36ec"
        }
      ],
      "maintenance": {
        "status": "archived",
        "github_archived": true,
        "last_push_at": "2026-04-04T07:53:49Z",
        "checked_at": "2026-10-20T10:06:02.368094+00:00",
        "note": "未归档/近期 push 不能证明当前型号无故障，镜像迁移也不等于项目停止维护。"
      },
      "license": {
        "label": "MIT",
        "url": "https://github.com/idootop/mi-gpt/blob/main/LICENSE",
        "checked_at": "2026-10-20T10:06:02.368094+00:00",
        "scope": "此仓库根许可证或 README 声明；不代表捆绑固件、模型、品牌或第三方组件同许可。"
      },
      "requirements": {
        "disassembly": "no",
        "soldering": "no",
        "cloud_api": "required-xiaomi"
      },
      "cost": {
        "amount": null,